<?xml version='1.0' encoding='UTF-8'?>
<?xml-stylesheet type="text/xsl" href="contenu.xslt"?>


<portfolio xmlns:rdf="http://www.w3.org/1999/02/22-rdf-syntax-ns#" 
          xmlns:xsi="http://www.w3.org/2001/XMLSchema-instance"
           rdf:about="contenu.xml"
           rdf:seeAlso="contenu.rdf"
           xsi:noNamespaceSchemaLocation="contenu.xsd">
  <profil lang="fr">
    <nom>EL YOUNOUSSI Fatimazahra</nom>
    <ville>Paris, France</ville>
    <email>fz.elyounoussi@gmail.com</email>
    <presentation>Je m'appelle EL YOUNOUSSI Fatimazahra, je suis actuellement apprentie en deuxième année d'école d'ingénieur à Sup Galilée, et développeuse full-stack chez Dassault Systèmes depuis un an. Avant cela, j'ai effectué une classe préparatoire MP (Maths-Physique)...</presentation>

    <competences>
      <competence>HTML</competence>
      <competence>CSS</competence>
      <competence>C++</competence>
      <competence>Haskell</competence>
      <competence>C</competence>
      <competence>Python</competence>
      <competence>JavaScript</competence>
      <competence>PHP</competence>
      <competence>MySQL</competence>
      <competence>Cisco</competence>
      <competence>Java</competence>
      <competence>UML</competence>
    </competences>

    <passions>
      <passion id="insta">Je poste des moments de ma vie et des instants mignons sur les réseaux sociaux comme Instagram et TikTok.</passion>
      <passion id="matcha">Le matcha est une boisson que je consomme tous les jours. C’est plus qu’une boisson, c’est un rituel pour moi.</passion>
      <passion id="books">Je lis de tout, des romans aux essais, et je suis particulièrement attirée par le true crime comme la série 'The Fear'.</passion>
      <passion id="travel">J’ai visité le Canada, l’Italie, l’Allemagne, l’Espagne, la Turquie, le Royaume-Uni et les Pays-Bas.</passion>
      <passion id="yoga">Je pratique le yoga. C’est une activité qui m’aide à me concentrer et à me dépasser.</passion>
    </passions>

    <projets>
      <projet id="cinetica">
        <titre>Cinetica 🎬</titre>
        <description>Cinetica est une application web de découverte de films et de séries. Elle permet d'afficher dynamiquement les castings, les affiches, les descriptions, les dates de sortie, etc. Les données sont récupérées en JSON via une API REST. J'ai utilisé TypeScript, Node.js et les outils modernes du front-end.</description>
        <technos>TypeScript, Node.js, REST API, JSON</technos>
        <images>
          <img>images/login.png</img>
          <img>images/discoverPage.png</img>
          <img>images/detailsPage.png</img>
        </images>
      </projet>
    </projets>

    <contact>
      <titre>Me contacter</titre>
      <labels>
        <nom>Nom</nom>
        <email>Email</email>
        <message>Message</message>
        <envoyer>Envoyer</envoyer>
      </labels>
      <confirmation>Merci {nom}, votre message a bien été envoyé !</confirmation>
    </contact>
  </profil>

  <profil lang="en">
    <nom>Fatimazahra EL YOUNOUSSI</nom>
    <ville>Paris, France</ville>
    <email>fz.elyounoussi@gmail.com</email>
    <presentation>My name is Fatimazahra EL YOUNOUSSI. I am currently a second-year engineering student at Sup Galilée and a full-stack developer apprentice at Dassault Systèmes...</presentation>

    <competences>
      <competence>HTML</competence>
      <competence>CSS</competence>
      <competence>C++</competence>
      <competence>Haskell</competence>
      <competence>C</competence>
      <competence>Python</competence>
      <competence>JavaScript</competence>
      <competence>PHP</competence>
      <competence>MySQL</competence>
      <competence>Cisco</competence>
      <competence>Java</competence>
      <competence>UML</competence>
    </competences>

    <passions>
      <passion id="insta">I share moments from my life and cute little things on social media like Instagram and TikTok.</passion>
      <passion id="matcha">Matcha is a drink I have every day. It’s more than just a beverage, it’s a ritual for me.</passion>
      <passion id="books">I read everything from novels to essays, and I’m especially into true crime stories like the series 'The Fear'.</passion>
      <passion id="travel">I’ve visited Canada, Italy, Germany, Spain, Turkey, the UK, and the Netherlands.</passion>
      <passion id="yoga">I practice yoga. It helps me focus and push my limits.</passion>
    </passions>

    <projets>
      <projet id="cinetica">
        <titre>Cinetica 🎬</titre>
        <description>Cinetica is a web app to explore movies and TV shows. It fetches cast, posters, descriptions, and release dates from an external API (JSON via REST). I built it using TypeScript, Node.js, and modern frontend tools.</description>
        <technos>TypeScript, Node.js, REST API, JSON</technos>
        <images>
          <img>images/login.png</img>
          <img>images/discoverPage.png</img>
          <img>images/detailsPage.png</img>
        </images>
      </projet>
    </projets>

    <contact>
      <titre>Contact Me</titre>
      <labels>
        <nom>Name</nom>
        <email>Email</email>
        <message>Message</message>
        <envoyer>Send</envoyer>
      </labels>
      <confirmation>Thank you {nom}, your message has been sent!</confirmation>
    </contact>
  </profil>

  <profil lang="ar">
    <nom>فاطمة الزهراء الينوسي</nom>
    <ville>باريس، فرنسا</ville>
    <email>fz.elyounoussi@gmail.com</email>
    <presentation>اسمي فاطمة الزهراء الينوسي، أنا حالياً طالبة في السنة الثانية في مدرسة المهندسين Sup Galilée، ومتدربة كمطورة Full Stack في شركة Dassault Systèmes...</presentation>

    <competences>
      <competence>HTML</competence>
      <competence>CSS</competence>
      <competence>C++</competence>
      <competence>هاسكل</competence>
      <competence>C</competence>
      <competence>بايثون</competence>
      <competence>جافاسكريبت</competence>
      <competence>PHP</competence>
      <competence>MySQL</competence>
      <competence>سيسكو</competence>
      <competence>جافا</competence>
      <competence>UML</competence>
    </competences>

    <passions>
      <passion id="insta">أنشر لحظات من حياتي وأشياء لطيفة على وسائل التواصل الاجتماعي مثل إنستغرام وتيك توك.</passion>
      <passion id="matcha">الماتشا هو مشروبي اليومي. إنه أكثر من مجرد مشروب، إنه طقس يومي بالنسبة لي.</passion>
      <passion id="books">أقرأ كل شيء من الروايات إلى المقالات، وأحب بشكل خاص قصص الجريمة الحقيقية مثل سلسلة 'The Fear'.</passion>
      <passion id="travel">زرت كندا، إيطاليا، ألمانيا، إسبانيا، تركيا، المملكة المتحدة وهولندا.</passion>
      <passion id="yoga">أنا أمارس اليوغا. إنها تساعدني على التركيز وتجاوز حدودي.</passion>
    </passions>

    <projets>
      <projet id="cinetica">
        <titre>Cinetica 🎬</titre>
        <description>Cinetica هو تطبيق ويب لاكتشاف الأفلام والمسلسلات. يعرض معلومات مثل الطاقم، الملصقات، الوصف، وتواريخ الإصدار، ويتم جلب البيانات من واجهة API باستخدام JSON. استخدمت فيه TypeScript وNode.js وأدوات حديثة للواجهة الأمامية.</description>
        <technos>TypeScript, Node.js, REST API, JSON</technos>
        <images>
          <img>images/login.png</img>
          <img>images/discoverPage.png</img>
          <img>images/detailsPage.png</img>
        </images>
      </projet>
    </projets>

    <contact>
      <titre>اتصل بي</titre>
      <labels>
        <nom>الاسم</nom>
        <email>البريد الإلكتروني</email>
        <message>الرسالة</message>
        <envoyer>إرسال</envoyer>
      </labels>
      <confirmation>شكراً لك {nom}، تم إرسال رسالتك بنجاح!</confirmation>
    </contact>
  </profil>
</portfolio>
